sector,exposure_class,direct_energy_spend_b_usd,shock_low_pct,shock_base_pct,shock_high_pct,pass_through_low_pct,pass_through_base_pct,pass_through_high_pct,added_cost_low_b_usd,added_cost_base_b_usd,added_cost_high_b_usd,source_urls,note
Chemicals,direct_fuel_electricity,77.1,15,25,40,35,60,90,4.048,11.565,27.756,https://www.eia.gov/consumption/manufacturing/data/2022/ | https://www.eia.gov/outlooks/steo/report/petro_prod.php,EIA MECS 2022 purchased energy expenditures; direct-fuel/electricity pass-through band from l8m.2.
Petroleum and coal products,direct_fuel_electricity,26.3,15,25,40,35,60,90,1.381,3.945,9.468,https://www.eia.gov/consumption/manufacturing/data/2022/ | https://www.eia.gov/outlooks/steo/report/petro_prod.php,EIA MECS 2022 purchased energy expenditures; direct-fuel/electricity pass-through band from l8m.2.
Primary metals,direct_fuel_electricity,16.5,15,25,40,35,60,90,0.866,2.475,5.940,https://www.eia.gov/consumption/manufacturing/data/2022/ | https://www.eia.gov/outlooks/steo/report/petro_prod.php,EIA MECS 2022 purchased energy expenditures; direct-fuel/electricity pass-through band from l8m.2.
Food,tier2_inputs_freight,12.4,15,25,40,20,35,55,0.372,1.085,2.728,https://www.eia.gov/consumption/manufacturing/data/2022/ | https://www.eia.gov/outlooks/steo/report/petro_prod.php,EIA MECS 2022 purchased energy expenditures; tier-2 inputs/freight pass-through band from l8m.2.
Paper,tier2_inputs_freight,9.6,15,25,40,20,35,55,0.288,0.840,2.112,https://www.eia.gov/consumption/manufacturing/data/2022/ | https://www.eia.gov/outlooks/steo/report/petro_prod.php,EIA MECS 2022 purchased energy expenditures; tier-2 inputs/freight pass-through band from l8m.2.
